[
  {
    "action_id": "resonance_multiplier_1_2",
    "system": "tech_parts",
    "action_type": "upgrade_resonance_multiplier",
    "target_id": "resonance_multiplier",
    "requirements": {
      "current_multiplier": 1.0
    },
    "costs": [
      {
        "resource_id": "resonance_chip",
        "amount": 1
      }
    ],
    "effects": [
      {
        "effect_type": "resonance_multiplier_delta",
        "value": 0.2,
        "unit": "multiplier",
        "damage_bucket": "skill_specific"
      }
    ],
    "expected_dps_gain": null,
    "breakpoint_distance": null,
    "unlock_target": "1.2",
    "confidence": "exact",
    "explanation_key": "resonance_multiplier_upgrade",
    "aliases": [],
    "source_row_ids": [
      "src_db44ff4a4bd4db46"
    ],
    "enabled": true,
    "disabled_reason": null
  },
  {
    "action_id": "resonance_multiplier_1_4",
    "system": "tech_parts",
    "action_type": "upgrade_resonance_multiplier",
    "target_id": "resonance_multiplier",
    "requirements": {
      "current_multiplier": 1.2
    },
    "costs": [
      {
        "resource_id": "resonance_chip",
        "amount": 1
      }
    ],
    "effects": [
      {
        "effect_type": "resonance_multiplier_delta",
        "value": 0.2,
        "unit": "multiplier",
        "damage_bucket": "skill_specific"
      }
    ],
    "expected_dps_gain": null,
    "breakpoint_distance": null,
    "unlock_target": "1.4",
    "confidence": "exact",
    "explanation_key": "resonance_multiplier_upgrade",
    "aliases": [],
    "source_row_ids": [
      "src_50c58b4ead13cc95"
    ],
    "enabled": true,
    "disabled_reason": null
  },
  {
    "action_id": "resonance_multiplier_1_6",
    "system": "tech_parts",
    "action_type": "upgrade_resonance_multiplier",
    "target_id": "resonance_multiplier",
    "requirements": {
      "current_multiplier": 1.4
    },
    "costs": [
      {
        "resource_id": "resonance_chip",
        "amount": 2
      }
    ],
    "effects": [
      {
        "effect_type": "resonance_multiplier_delta",
        "value": 0.2,
        "unit": "multiplier",
        "damage_bucket": "skill_specific"
      }
    ],
    "expected_dps_gain": null,
    "breakpoint_distance": null,
    "unlock_target": "1.6",
    "confidence": "exact",
    "explanation_key": "resonance_multiplier_upgrade",
    "aliases": [],
    "source_row_ids": [
      "src_12f5c540b97846b6"
    ],
    "enabled": true,
    "disabled_reason": null
  },
  {
    "action_id": "resonance_multiplier_1_8",
    "system": "tech_parts",
    "action_type": "upgrade_resonance_multiplier",
    "target_id": "resonance_multiplier",
    "requirements": {
      "current_multiplier": 1.6
    },
    "costs": [
      {
        "resource_id": "resonance_chip",
        "amount": 3
      }
    ],
    "effects": [
      {
        "effect_type": "resonance_multiplier_delta",
        "value": 0.2,
        "unit": "multiplier",
        "damage_bucket": "skill_specific"
      }
    ],
    "expected_dps_gain": null,
    "breakpoint_distance": null,
    "unlock_target": "1.8",
    "confidence": "exact",
    "explanation_key": "resonance_multiplier_upgrade",
    "aliases": [],
    "source_row_ids": [
      "src_d90bc5bc6ca7f2a0"
    ],
    "enabled": true,
    "disabled_reason": null
  },
  {
    "action_id": "resonance_multiplier_2_0",
    "system": "tech_parts",
    "action_type": "upgrade_resonance_multiplier",
    "target_id": "resonance_multiplier",
    "requirements": {
      "current_multiplier": 1.8
    },
    "costs": [
      {
        "resource_id": "resonance_chip",
        "amount": 5
      }
    ],
    "effects": [
      {
        "effect_type": "resonance_multiplier_delta",
        "value": 0.2,
        "unit": "multiplier",
        "damage_bucket": "skill_specific"
      }
    ],
    "expected_dps_gain": null,
    "breakpoint_distance": null,
    "unlock_target": "2.0",
    "confidence": "exact",
    "explanation_key": "resonance_multiplier_upgrade",
    "aliases": [],
    "source_row_ids": [
      "src_050dea9ce474c103"
    ],
    "enabled": true,
    "disabled_reason": null
  },
  {
    "action_id": "resonance_multiplier_2_2",
    "system": "tech_parts",
    "action_type": "upgrade_resonance_multiplier",
    "target_id": "resonance_multiplier",
    "requirements": {
      "current_multiplier": 2.0
    },
    "costs": [
      {
        "resource_id": "resonance_chip",
        "amount": 5
      }
    ],
    "effects": [
      {
        "effect_type": "resonance_multiplier_delta",
        "value": 0.2,
        "unit": "multiplier",
        "damage_bucket": "skill_specific"
      }
    ],
    "expected_dps_gain": null,
    "breakpoint_distance": null,
    "unlock_target": "2.2",
    "confidence": "exact",
    "explanation_key": "resonance_multiplier_upgrade",
    "aliases": [],
    "source_row_ids": [
      "src_38012e9eac9332f8"
    ],
    "enabled": true,
    "disabled_reason": null
  },
  {
    "action_id": "resonance_multiplier_2_4",
    "system": "tech_parts",
    "action_type": "upgrade_resonance_multiplier",
    "target_id": "resonance_multiplier",
    "requirements": {
      "current_multiplier": 2.2
    },
    "costs": [
      {
        "resource_id": "resonance_chip",
        "amount": 7
      }
    ],
    "effects": [
      {
        "effect_type": "resonance_multiplier_delta",
        "value": 0.2,
        "unit": "multiplier",
        "damage_bucket": "skill_specific"
      }
    ],
    "expected_dps_gain": null,
    "breakpoint_distance": null,
    "unlock_target": "2.4",
    "confidence": "exact",
    "explanation_key": "resonance_multiplier_upgrade",
    "aliases": [],
    "source_row_ids": [
      "src_76db5e08a7aadad8"
    ],
    "enabled": true,
    "disabled_reason": null
  },
  {
    "action_id": "resonance_multiplier_2_6",
    "system": "tech_parts",
    "action_type": "upgrade_resonance_multiplier",
    "target_id": "resonance_multiplier",
    "requirements": {
      "current_multiplier": 2.4
    },
    "costs": [
      {
        "resource_id": "resonance_chip",
        "amount": 9
      }
    ],
    "effects": [
      {
        "effect_type": "resonance_multiplier_delta",
        "value": 0.2,
        "unit": "multiplier",
        "damage_bucket": "skill_specific"
      }
    ],
    "expected_dps_gain": null,
    "breakpoint_distance": null,
    "unlock_target": "2.6",
    "confidence": "exact",
    "explanation_key": "resonance_multiplier_upgrade",
    "aliases": [],
    "source_row_ids": [
      "src_966ef5c3fea20d1e"
    ],
    "enabled": true,
    "disabled_reason": null
  },
  {
    "action_id": "resonance_multiplier_2_8",
    "system": "tech_parts",
    "action_type": "upgrade_resonance_multiplier",
    "target_id": "resonance_multiplier",
    "requirements": {
      "current_multiplier": 2.6
    },
    "costs": [
      {
        "resource_id": "resonance_chip",
        "amount": 12
      }
    ],
    "effects": [
      {
        "effect_type": "resonance_multiplier_delta",
        "value": 0.2,
        "unit": "multiplier",
        "damage_bucket": "skill_specific"
      }
    ],
    "expected_dps_gain": null,
    "breakpoint_distance": null,
    "unlock_target": "2.8",
    "confidence": "exact",
    "explanation_key": "resonance_multiplier_upgrade",
    "aliases": [],
    "source_row_ids": [
      "src_15bb3f2a94a16f83"
    ],
    "enabled": true,
    "disabled_reason": null
  },
  {
    "action_id": "resonance_multiplier_3_0",
    "system": "tech_parts",
    "action_type": "upgrade_resonance_multiplier",
    "target_id": "resonance_multiplier",
    "requirements": {
      "current_multiplier": 2.8
    },
    "costs": [
      {
        "resource_id": "resonance_chip",
        "amount": 15
      }
    ],
    "effects": [
      {
        "effect_type": "resonance_multiplier_delta",
        "value": 0.2,
        "unit": "multiplier",
        "damage_bucket": "skill_specific"
      }
    ],
    "expected_dps_gain": null,
    "breakpoint_distance": null,
    "unlock_target": "3.0",
    "confidence": "exact",
    "explanation_key": "resonance_multiplier_upgrade",
    "aliases": [],
    "source_row_ids": [
      "src_39f24768de1c4764"
    ],
    "enabled": true,
    "disabled_reason": null
  },
  {
    "action_id": "upgrade_doomsteed_r1",
    "system": "mounts",
    "action_type": "upgrade_mount",
    "target_id": "doomsteed",
    "requirements": {
      "current_rarity_precedes": "R1",
      "mount_owned": "doomsteed"
    },
    "costs": [
      {
        "resource_id": "doomsteed_shard",
        "amount": 100
      },
      {
        "resource_id": "mount_core",
        "amount": 4
      }
    ],
    "effects": [
      {
        "effect_type": "attack_sync_rate_target",
        "value": 0.71,
        "unit": "ratio",
        "damage_bucket": "attack"
      }
    ],
    "expected_dps_gain": null,
    "breakpoint_distance": null,
    "unlock_target": "R1",
    "confidence": "exact",
    "explanation_key": "mount_sync_rate_upgrade",
    "aliases": [],
    "source_row_ids": [
      "src_049fe92cd8d44f14",
      "src_3b5c8df70dde3d9c",
      "src_b333d376b803c453"
    ],
    "enabled": true,
    "disabled_reason": null
  },
  {
    "action_id": "upgrade_doomsteed_r2",
    "system": "mounts",
    "action_type": "upgrade_mount",
    "target_id": "doomsteed",
    "requirements": {
      "current_rarity_precedes": "R2",
      "mount_owned": "doomsteed"
    },
    "costs": [
      {
        "resource_id": "doomsteed_shard",
        "amount": 140
      },
      {
        "resource_id": "mount_core",
        "amount": 4
      }
    ],
    "effects": [
      {
        "effect_type": "attack_sync_rate_target",
        "value": 0.8,
        "unit": "ratio",
        "damage_bucket": "attack"
      }
    ],
    "expected_dps_gain": null,
    "breakpoint_distance": null,
    "unlock_target": "R2",
    "confidence": "exact",
    "explanation_key": "mount_sync_rate_upgrade",
    "aliases": [],
    "source_row_ids": [